{
  "arv": "1.0",
  "question": "How do I set the idle mixture on a carburettor?",
  "shape": "steps",
  "coverage": "complete",
  "references": [
    {
      "moment_uri": "arv:vid_8f2c#t=12400,31000",
      "role": "step",
      "step_index": 1,
      "span": {
        "type": "transcript",
        "start_ms": 12900,
        "end_ms": 18200,
        "text": "Turn the mixture screw a quarter turn out"
      }
    },
    {
      "moment_uri": "arv:vid_8f2c#t=31000,52000",
      "role": "step",
      "step_index": 2,
      "span": {
        "type": "transcript",
        "start_ms": 33500,
        "end_ms": 39000,
        "text": "Then turn it back in until the idle is smooth"
      }
    }
  ],
  "actions": [
    {
      "label": "Book a tune-up",
      "action": "book",
      "kind": "service",
      "url": "https://example.com/book"
    }
  ]
}
